{
  "schema_version": "1.0.0",
  "evidence_type": "catalyst_uncertainty_sensitivity_evidence",
  "contract": "sc.analytics-r.uncertainty-sensitivity-runtime.v1",
  "analysis_ref": "core.analysis.uncertainty-demo",
  "method": "sobol",
  "summary": [],
  "sensitivity": [
    {
      "target": "parameters.emissions_intensity",
      "metric": "emissions",
      "first_order": 0.41,
      "total_order": 0.57,
      "variance": 12.4,
      "n": 128,
      "first_order_estimator": "saltelli_2010",
      "total_order_estimator": "jansen_1999"
    }
  ],
  "source_refs": [
    "workspace.execution.example"
  ],
  "limitations": [
    "Sensitivity indices are model- and distribution-conditional estimates."
  ],
  "provenance": {
    "provider_key": "catalystanalyticsr",
    "provider_version": "2.3.0",
    "runtime": "r",
    "execution_host": "workspace",
    "created_at": "2026-09-22T00:00:00Z"
  },
  "boundary": {
    "uncertainty_is_evidence_not_truth": true,
    "sensitivity_does_not_establish_causality": true,
    "no_automatic_policy_preference": true,
    "no_automatic_scientific_validity_certification": true,
    "human_review_required": true
  }
}
